[
  {
    "cardId": "cups-01",
    "cardNameVi": "Át Cốc",
    "cardNameEn": "Ace of Cups",
    "type": "minor",
    "suit": "cups",
    "number": 1,
    "state": "upright",
    "sourceSnippet": "Từ khóa: tình cảm mới, trực giác, mở lòng. Ý nghĩa: Át Cốc xuôi nhấn mạnh tình cảm mới, trực giác, mở lòng; hãy liên hệ năng lượng này với vị trí của lá trong trải bài.",
    "core": {
      "ACT": {
        "score": 0,
        "evidenceQuote": "",
        "evidenceQuotes": [],
        "evidenceStatus": "insufficient",
        "rationale": "Nguồn của trạng thái này không đủ bằng chứng để xác định hướng và mức độ trên trục; 0 là giá trị bỏ qua, không phải xác nhận trung tính.",
        "confidence": null,
        "eligibleForRelations": false,
        "alternatives": []
      },
      "EMO": {
        "score": 1,
        "evidenceQuote": "mở lòng",
        "evidenceQuotes": [
          {
            "quote": "mở lòng",
            "sourceField": "keywords.upright.2.vi",
            "start": 0,
            "end": 7
          }
        ],
        "evidenceStatus": "supported",
        "rationale": "“mở lòng” hỗ trợ Cảm xúc & Gắn kết ở mức +1: Mở lòng, tương hỗ, hòa giải hoặc kết nối. Chỉ mã hóa nội dung của nguồn; dấu điểm biểu thị hướng đặc tính, không phải tốt/xấu.",
        "confidence": null,
        "eligibleForRelations": true,
        "alternatives": []
      },
      "STR": {
        "score": 0,
        "evidenceQuote": "",
        "evidenceQuotes": [],
        "evidenceStatus": "insufficient",
        "rationale": "Nguồn của trạng thái này không đủ bằng chứng để xác định hướng và mức độ trên trục; 0 là giá trị bỏ qua, không phải xác nhận trung tính.",
        "confidence": null,
        "eligibleForRelations": false,
        "alternatives": []
      },
      "RSK": {
        "score": 0,
        "evidenceQuote": "",
        "evidenceQuotes": [],
        "evidenceStatus": "insufficient",
        "rationale": "Nguồn của trạng thái này không đủ bằng chứng để xác định hướng và mức độ trên trục; 0 là giá trị bỏ qua, không phải xác nhận trung tính.",
        "confidence": null,
        "eligibleForRelations": false,
        "alternatives": []
      },
      "INT": {
        "score": 2,
        "evidenceQuote": "trực giác",
        "evidenceQuotes": [
          {
            "quote": "trực giác",
            "sourceField": "keywords.upright.1.vi",
            "start": 0,
            "end": 9
          }
        ],
        "evidenceStatus": "supported",
        "rationale": "“trực giác” hỗ trợ Trực giác & Tự nhận thức ở mức +2: Trực giác/trí tuệ nội tâm hoặc thức tỉnh được nêu rõ. Chỉ mã hóa nội dung của nguồn; dấu điểm biểu thị hướng đặc tính, không phải tốt/xấu.",
        "confidence": null,
        "eligibleForRelations": true,
        "alternatives": []
      }
    },
    "shadow": {
      "ACT": {
        "score": 0,
        "evidenceQuote": "",
        "evidenceQuotes": [],
        "evidenceStatus": "insufficient",
        "rationale": "Nguồn của trạng thái này không đủ bằng chứng để xác định hướng và mức độ trên trục; 0 là giá trị bỏ qua, không phải xác nhận trung tính.",
        "confidence": null,
        "eligibleForRelations": false,
        "alternatives": []
      },
      "EMO": {
        "score": 0,
        "evidenceQuote": "",
        "evidenceQuotes": [],
        "evidenceStatus": "insufficient",
        "rationale": "Nguồn của trạng thái này không đủ bằng chứng để xác định hướng và mức độ trên trục; 0 là giá trị bỏ qua, không phải xác nhận trung tính.",
        "confidence": null,
        "eligibleForRelations": false,
        "alternatives": []
      },
      "STR": {
        "score": 0,
        "evidenceQuote": "",
        "evidenceQuotes": [],
        "evidenceStatus": "insufficient",
        "rationale": "Nguồn của trạng thái này không đủ bằng chứng để xác định hướng và mức độ trên trục; 0 là giá trị bỏ qua, không phải xác nhận trung tính.",
        "confidence": null,
        "eligibleForRelations": false,
        "alternatives": []
      },
      "RSK": {
        "score": 0,
        "evidenceQuote": "",
        "evidenceQuotes": [],
        "evidenceStatus": "insufficient",
        "rationale": "Nguồn của trạng thái này không đủ bằng chứng để xác định hướng và mức độ trên trục; 0 là giá trị bỏ qua, không phải xác nhận trung tính.",
        "confidence": null,
        "eligibleForRelations": false,
        "alternatives": []
      },
      "INT": {
        "score": 0,
        "evidenceQuote": "",
        "evidenceQuotes": [],
        "evidenceStatus": "insufficient",
        "rationale": "Nguồn của trạng thái này không đủ bằng chứng để xác định hướng và mức độ trên trục; 0 là giá trị bỏ qua, không phải xác nhận trung tính.",
        "confidence": null,
        "eligibleForRelations": false,
        "alternatives": []
      }
    },
    "overallConfidence": null,
    "confidenceMethod": "uncalibrated",
    "evidenceCoverage": 0.2,
    "annotationVersion": "3.0.0",
    "rubricVersion": "3.0.0",
    "sourceSha256": "e77787c6e66ba7a2d7b2e766e9aa0e0a9a82b6037c26eea93e74025cf58c744d",
    "rubricSha256": "8a88c52305c5ac09045f42032411317c26c874b98c4703075ce131b461b3dee0",
    "provenance": {
      "runId": "source-reannotation-2026-10-01-v3",
      "annotatorType": "ai",
      "method": "explicit-source-reannotation",
      "modelId": null,
      "decisionSha256": "7e7223e19f8c76c6b73b6c99859d9ceed1fde745fce0799b3724a197ec98f652",
      "inferenceSha256": "0d55802e2fc6e74318f998632b43eb097eeffa37ebfd844642e8962302bb8b20",
      "independentRuns": 1,
      "humanReviewed": false
    },
    "reviewStatus": "silver-inferred-human-unvalidated",
    "reviewFlags": []
  },
  {
    "cardId": "cups-01",
    "cardNameVi": "Át Cốc",
    "cardNameEn": "Ace of Cups",
    "type": "minor",
    "suit": "cups",
    "number": 1,
    "state": "reversed",
    "sourceSnippet": "Từ khóa: cảm xúc nghẽn, trống rỗng, thu mình. Ý nghĩa: Át Cốc ngược gợi ý cảm xúc nghẽn, trống rỗng, thu mình; đây là điểm cần nhìn lại thay vì một kết luận cố định.",
    "core": {
      "ACT": {
        "score": 0,
        "evidenceQuote": "",
        "evidenceQuotes": [],
        "evidenceStatus": "insufficient",
        "rationale": "Nguồn của trạng thái này không đủ bằng chứng để xác định hướng và mức độ trên trục; 0 là giá trị bỏ qua, không phải xác nhận trung tính.",
        "confidence": null,
        "eligibleForRelations": false,
        "alternatives": []
      },
      "EMO": {
        "score": -2,
        "evidenceQuote": "cảm xúc nghẽn",
        "evidenceQuotes": [
          {
            "quote": "cảm xúc nghẽn",
            "sourceField": "keywords.reversed.0.vi",
            "start": 0,
            "end": 13
          }
        ],
        "evidenceStatus": "supported",
        "rationale": "“cảm xúc nghẽn” hỗ trợ Cảm xúc & Gắn kết ở mức -2: Cô lập, lạnh nhạt, cảm xúc nghẽn hoặc thao túng quan hệ rõ rệt. Chỉ mã hóa nội dung của nguồn; dấu điểm biểu thị hướng đặc tính, không phải tốt/xấu.",
        "confidence": null,
        "eligibleForRelations": true,
        "alternatives": []
      },
      "STR": {
        "score": 0,
        "evidenceQuote": "",
        "evidenceQuotes": [],
        "evidenceStatus": "insufficient",
        "rationale": "Nguồn của trạng thái này không đủ bằng chứng để xác định hướng và mức độ trên trục; 0 là giá trị bỏ qua, không phải xác nhận trung tính.",
        "confidence": null,
        "eligibleForRelations": false,
        "alternatives": []
      },
      "RSK": {
        "score": 0,
        "evidenceQuote": "",
        "evidenceQuotes": [],
        "evidenceStatus": "insufficient",
        "rationale": "Nguồn của trạng thái này không đủ bằng chứng để xác định hướng và mức độ trên trục; 0 là giá trị bỏ qua, không phải xác nhận trung tính.",
        "confidence": null,
        "eligibleForRelations": false,
        "alternatives": []
      },
      "INT": {
        "score": 0,
        "evidenceQuote": "",
        "evidenceQuotes": [],
        "evidenceStatus": "insufficient",
        "rationale": "Nguồn của trạng thái này không đủ bằng chứng để xác định hướng và mức độ trên trục; 0 là giá trị bỏ qua, không phải xác nhận trung tính.",
        "confidence": null,
        "eligibleForRelations": false,
        "alternatives": []
      }
    },
    "shadow": {
      "ACT": {
        "score": 0,
        "evidenceQuote": "",
        "evidenceQuotes": [],
        "evidenceStatus": "insufficient",
        "rationale": "Nguồn của trạng thái này không đủ bằng chứng để xác định hướng và mức độ trên trục; 0 là giá trị bỏ qua, không phải xác nhận trung tính.",
        "confidence": null,
        "eligibleForRelations": false,
        "alternatives": []
      },
      "EMO": {
        "score": -2,
        "evidenceQuote": "cảm xúc nghẽn",
        "evidenceQuotes": [
          {
            "quote": "cảm xúc nghẽn",
            "sourceField": "keywords.reversed.0.vi",
            "start": 0,
            "end": 13
          }
        ],
        "evidenceStatus": "supported",
        "rationale": "“cảm xúc nghẽn” hỗ trợ Cảm xúc & Gắn kết ở mức -2: Cô lập, lạnh nhạt, cảm xúc nghẽn hoặc thao túng quan hệ rõ rệt. Chỉ mã hóa nội dung của nguồn; dấu điểm biểu thị hướng đặc tính, không phải tốt/xấu.",
        "confidence": null,
        "eligibleForRelations": true,
        "alternatives": []
      },
      "STR": {
        "score": 0,
        "evidenceQuote": "",
        "evidenceQuotes": [],
        "evidenceStatus": "insufficient",
        "rationale": "Nguồn của trạng thái này không đủ bằng chứng để xác định hướng và mức độ trên trục; 0 là giá trị bỏ qua, không phải xác nhận trung tính.",
        "confidence": null,
        "eligibleForRelations": false,
        "alternatives": []
      },
      "RSK": {
        "score": 0,
        "evidenceQuote": "",
        "evidenceQuotes": [],
        "evidenceStatus": "insufficient",